{
  "feature": "test-feature",
  "phase": 1,
  "goal": "Resolve clarification for: Add ticket fidelity checking to specify",
  "scope": "Phase 1 clarification gate — pending questions: 1) Should fidelity check block on unparseable ACs?",
  "relevant_files": [
    "docs/issues/tickets/ISS-099.md"
  ],
  "acceptance_criteria": [
    "pending-clarification"
  ],
  "verification_commands": [
    "cat .claude/handoff.json"
  ],
  "source_spec": "docs/issues/tickets/ISS-099.md",
  "checkpoint_pending": "clarification",
  "produced_by": "product-owner",
  "timestamp": "2026-04-13T22:00:00Z"
}
